{
  "description": "A sample description.",
  "destination": "example_value",
  "ipProtocol": "example_value",
  "mask": "example_value",
  "pool": "example_value",
  "profiles": [],
  "persist": [],
  "source": "example_value",
  "sourcePort": "example_value",
  "translateAddress": "example_value",
  "translatePort": "example_value",
  "connectionLimit": 10,
  "enabled": true,
  "disabled": true,
  "mirror": "example_value",
  "rateLimit": "example_value",
  "rules": [],
  "vlans": [],
  "vlansEnabled": true,
  "vlansDisabled": true,
  "fallbackPersistence": "example_value"
}